{
  "required" : true ,
  "$schema" : "http://json-schema.org/draft-03/schema" ,
  "type" : "object" ,
  "properties" : {
    "globalId" : {
      "type" : "string" ,
      "required" : false
    } ,
    "myCustomLinkProperty" : {
      "type" : "boolean" ,
      "required" : false
    } ,
    "colors" : {
      "type" : "array" ,
      "required" : false ,
      "items" : [
        {
          "type" : "string"
        }
      ]
    } ,
    "notes" : {
      "type" : "array" ,
      "required" : false ,
      "items" : [
        {
          "type" : "string"
        }
      ]
    }
  }
}